[
  {
    "attributes": {
      "llmobs.dq.usage_total_mismatch": true,
      "resource.service.name": "chat-svc"
    },
    "end_time": "2024-07-03T09:46:41Z",
    "environment": "default",
    "id": "70700000000000ff",
    "kind": "generation",
    "model": "gpt-4o",
    "name": "chat gpt-4o",
    "project_id": "proj_demo",
    "provided_usage_details": {
      "cache_read": 400,
      "input": 1000,
      "output": 200,
      "total": 1200
    },
    "raw_kind": "chat",
    "start_time": "2024-07-03T09:46:40Z",
    "status": {
      "code": "unset"
    },
    "trace_id": "7ef92f3577b34da6a3ce929d0e0e4736"
  }
]
